{
  "schema_version": "3.0",
  "kind": "bar-chart",
  "title": "Compiler Coverage by Release",
  "unit": " types",
  "categories": ["V2", "V3", "V4", "V4.3", "V5"],
  "series": [
    {"id": "covered", "label": "Generator-backed", "values": [2, 14, 17, 17, 22]},
    {"id": "legacy", "label": "Legacy HTML", "values": [12, 0, 0, 0, 0]}
  ],
  "focus_series": "covered"
}
